code,description,relatedEmdnCodes
42811,"Compression/pressure sock/stocking, reusable",
46207,Peristomal/periwound dressing,
62525,Intestinal ostomy bag/support kit,
47247,Cardiac transseptal access set,
58865,"Vascular catheter introduction set, nonimplantable",
47143,"Electrical-only medical device connection cable, single-use",
46355,"Cardiac mapping catheter, percutaneous, single-use",
45603,Single-administration urethral drainage catheter,
47732,"Coronary angioplasty balloon catheter, basic",
44732,Orthodontic aligner auxiliary attachment kit,
57815,"CPAP/BPAP nasal mask, reusable",
57814,"CPAP/BPAP face mask, reusable",
60712,Home BPAP unit,
60711,Home CPAP unit,
12050,Heated respiratory humidifier,
35113,Non-heated respiratory humidifier,
37705,"Ventilator breathing circuit, reusable",
35171,Rebreathing oxygen face mask,
40582,Ventilator application software,
63711,"Infrared patient thermometer, ear/skin",
45617,"Automatic-inflation electronic sphygmomanometer, portable, arm/wrist",
35379,"Universal operating table, electrohydraulic",
47764,"Wound hydrogel dressing, non-antimicrobial",
33199,"Flexible endoscopic tissue manipulation forceps, single-use",
46454,"Gastrointestinal/airway foreign body retrieval basket, single-use",
46715,"ERCP catheter, balloon, non-electrical, stone-retrieval",
61208,"Gastrointestinal endoscopic clip, long-term, non-bioabsorbable",
58039,"Endoscopic electrosurgical handpiece/electrode, monopolar, single-use",
62615,Mechanical-cutting endoscopic polypectomy snare,
34873,Manual hospital bed,
34870,Basic electric hospital bed,
16173,"Automatic-inflation electronic sphygmomanometer, non-portable",
32109,Haemodialysis system transducer protector,
12741,Haemodialysis needle,
34999,"Haemodialysis blood tubing set, single-use",
45607,Pulse oximeter,
17887,"Infrared patient thermometer, ear",
17888,"Infrared patient thermometer, skin",
56286,"Nitrile examination/treatment glove, non-powdered, non-antimicrobial",
36551,"Patient monitoring system module, blood pressure, noninvasive",
36022,Bioelectrical body composition analyser,
14035,Intermittent electronic patient thermometer,
56647,"Nasal aspirator, electric",
56552,"HLA class II antibody identification panel IVD, kit, enzyme immunoassay (EIA)",
55847,Dental implant system,
61641,"Dental implant abutment analog, intraoral-scanning, single-use",
45147,"Dental/maxillofacial surgical procedure kit, non-medicated, reusable",
45714,"Fixture/appliance dental drill bit, reusable",
14147,"Bone trephine, reusable",
64371,Dental implantation drilling template guide-sleeve,
46552,Dental implantation drilling template retention pin,
33968,"Surgical screwdriver, reusable",
45320,Dental drill bit extension,
64304,Manual non-rotary dental instrument handle,
44880,"Dental implant suprastructure, temporary, preformed, single-use",
61642,Dental implant analog,
57789,"Surgical drill guide, single-use",
58776,"Surgical screwdriver, single-use",
35095,"Surgical drill guide, reusable",
45697,"Fixture/appliance dental drill bit, single-use",
35429,Sharps container,
15155,"Inoculating tool IVD, manual",
57907,"Faecal specimen container IVD, no additive",
16822,Pipette tip,
11961,"Face splash shield, single-use",
62229,Test tube/reservoir cap,
46237,"General laboratory container, single-use",
57919,"24-hour urine specimen container IVD, no additive",
12500,Medical bag,
62669,Clinical specimen extraction buffer IVD,
37468,"Vaginal speculum, single-use",
35254,"General-purpose patient temperature probe, single-use",
47487,"Electrical-only medical device connection cable, reusable",
35562,"Electrocardiographic lead set, reusable",
42489,"Electrocardiographic electrode, reusable",
47976,"Femoral artery compression bandage, single-use",
12747,Intra-arterial needle,
17541,"Catheter/overtube balloon inflator, single-use",
63673,Infusion line manifold,
36079,Haemostasis valve,
46455,Torque manipulation device,
35094,"Cardiac/peripheral vascular guidewire, single-use",
61836,Cardiopulmonary bypass system pressure-monitoring tubing,
15286,Angiographic syringe,
56701,Chemiluminescent immunoassay analyser IVD,
60922,"Multiple form 25-hydroxy vitamin D IVD, kit, chemiluminescent immunoassay",
38262,"Total human chorionic gonadotropin IVD, control",
54413,"Free thyroxine (FT4) IVD, kit, chemiluminescent immunoassay",
54386,"Thyroid stimulating hormone (TSH) IVD, kit, chemiluminescent immunoassay",
47192,"Skin staple remover, single-use",
35884,"Skin stapler/staple, non-bioabsorbable",
33541,"Bone/joint surgical power tool motor, electric",
59875,"Intraluminal circular stapler, single-use",
47582,"Pulse Co-oximeter probe, reusable",
47581,"Pulse Co-oximeter probe, single-use",
37808,"Pulse oximeter probe, reusable",
61821,"Electrocardiographic lead set, single-use",
31658,"Pulse oximeter probe, single-use",
37326,"Blood pressure cuff, single-use",
34978,"Blood pressure cuff, reusable",
42412,"Laparoscopic access cannula, single-use",
65058,"Endoscopic surgical ligation clip applier, reusable",
46232,"Anaesthesia face mask, single-use",
42424,"Oropharyngeal airway, single-use",
60882,"Anaesthesia mask strap, single-use",
61326,"Cardiopulmonary resuscitation mask, single-use",
35693,"Cardiopulmonary resuscitation kit, single-use",
36086,"Pulmonary resuscitator, manual, single-use",
60657,"Non-rebreathing valve, single-use",
62385,"Gastrointestinal telemetric monitoring system capsule, ingestible",
63646,Surgical irrigation pump,
58029,"Foot-switch, pneumatic",
66200,"Suction/irrigation system canister/bottle holder, reusable",
63256,Rigid video hysteroscope,
31253,Medical device air compressor,
37240,"Hot/cold therapy pack, reusable",
34672,"Air-conduction hearing aid, in-the-ear",
34671,"Air-conduction hearing aid, behind-the-ear",
30082,"Air-conduction hearing aid, wearable case",
41191,Audiometer testing system,
40761,General-purpose ultrasound imaging system,
40768,"Extracorporeal ultrasound imaging transducer, hand-held",
36117,"Flexible video colonoscope, reusable",
17663,"Flexible video gastroscope, reusable",
18034,Endoscopic video image processing unit,
35158,"Endoscopic light source unit, line-powered",
36951,Flexible ultrasound gastroduodenoscope,
40770,Surgical ultrasound imaging transducer,
40771,Rectal/vaginal ultrasound imaging transducer,
37891,"Oesophageal ultrasound imaging transducer, reusable",
44685,Radiographic procedure tubing,
45275,Invasive blood pressure transducer set,
15275,"Bone awl, reusable",
17521,"Coronary angioplasty balloon catheter, perfusing",
47259,Contrast medium injection system syringe,
16545,Angiography kit,
47257,"Bone matrix implant, human-derived",
37340,"General-purpose patient temperature probe, reusable",
13100,"Intravenous pressure infusor, manual, reusable",
35927,"Invasive-pressure external transducer, single-use",
36306,"Nasal oxygen cannula, carbon-dioxide-sampling",
65172,"Intravenous pressure infusor, manual, single-use",
41917,Foetal Doppler system probe,
16866,"Dressing-fixation skin adhesive tape, non-silicone",
36652,Rigid optical cystourethroscope,
37243,"Manual blood lancing device, reusable",
47569,"Scalpel, single-use",
61578,"Manual blood lancing device, single-use",
61579,"Blood lancet, single-use",
36872,"Multiple vital physiological parameter monitoring system, clinical",
37697,Exothermic heat therapy pack/patch,
40555,"Hot/cold therapy pack, single-use",
35127,Intravenous administration bag/bottle,
60940,Neurovascular embolization coil,
59040,"ENFit oral/enteral syringe, single-use",
32712,"Retinoscope, battery-powered",
46784,"Retinoscope, line-powered",
61794,Direct otoscope/audiometer,
46786,Direct ophthalmoscope,
16800,Vision testing/training chart,
35148,Ophthalmic examination slit lamp,
32721,"Ophthalmic tonometer, manual",
35191,General-purpose surgical microscope,
10551,Ophthalmic fundus camera,
30045,Hand-held magnifier,
45729,Eye anterior segment analyser,
65244,Hand-held subjective ophthalmic refractometer,
64676,Ophthalmic surgical microscope,
18038,Corneal topography system,
64574,Peripheral intravenous cannula,
66199,"Surgical/medical face mask, non-antimicrobial, single-use",
47017,"General-purpose syringe, single-use",
63095,General-purpose syringe/needle,
35457,"Benchtop nebulizer, non-heated",
34040,Foetal Doppler system,
36888,Blood pressure ambulatory recorder,
38468,"Intravenous pressure infusor, automated",
13755,Mechanical external stethoscope,
16231,"Electrocardiograph, professional, multichannel",
31321,Mobile/portable oxygen concentrator,
54514,"Multiple urine analyte IVD, kit, rapid colorimetric, clinical",
56676,"Multiple clinical chemistry analyser IVD, laboratory",
38729,Telemetric electrocardiographic ambulatory recorder,
35162,Electrocardiographic ambulatory recorder,
38211,"Stand-on floor scale, electronic",
35918,"Urine analyser IVD, laboratory",
33586,General-purpose multi-parameter bedside monitor,
11413,"Electrocardiograph, professional, single-channel",
36400,"Ophthalmic instrument table, line-powered",
46290,Pre-prescription spectacle lens,
36255,"Static ophthalmic equipment stand, manually-adjusted",
35922,Visual acuity projector,
16345,Exophthalmometer,
16347,"Keratoscope, powered",
32731,Spectacle lens curvature gauge,
12326,"Manually-adjusted lensmeter, line-powered",
45753,Automated lensmeter,
36386,Automated ophthalmic refractometer,
32792,Trial lens clip,
36068,Trial lens set,
10749,Airway suction catheter,
45926,"Cricothyrotomy kit, single-use",
64309,Ureteral introduction sheath,
58923,"Wearable adult urine collection bag, open-ended",
46629,Temperature-monitoring indwelling urethral drainage catheter,
34858,"Surgical suction system collection container, single-use",
62145,"Endoscope working-channel valve, single-use",
46967,"Basic endotracheal tube, single-use",
46569,"Reinforced endotracheal tube, single-use",
42422,"Nasopharyngeal airway, single-use",
37469,"Artificial airway stylet, single-use",
12875,Oxygen administration tubing,
64677,"Urethral dilator, single-use",
34917,"Indwelling urethral drainage balloon catheter, non-antimicrobial",
31328,Endobronchial tube,
14221,Nasogastric feeding tube,
35201,"Nasal oxygen cannula, basic",
63564,"Endoscope sheath, single-use",
56731,Surgical tissue/fluid collection bag,
61504,Penis wearable urinal,
44333,"Urinary stone retrieval basket, single-use",
35404,"Tracheostomy tube, non-reinforced, non-customized, single-use",
36534,Portable/mobile rechargeable battery pack,
36349,"Patient monitoring system module, electrocardiographic",
58248,"Ultrasound imaging system tracking positioner, reusable",
37035,Barcode reader,
36336,"Foot-switch, electrical",
17508,Video printer,
40596,Electromechanical device/system transport trolley,
11440,"Analytical scalp electrode, single-use",
42411,Neonatal/adult intensive-care ventilator,
47769,"Anaesthesia unit, mobile",
55854,"Full blood count IVD, kit, cell count",
35586,Hand rail,
36553,"Patient monitoring system module, multifunction",
17506,Gel warmer,
47770,"Anaesthesia unit, wall-mounted",
17115,Noninvasive device battery charger,
36554,"Patient monitoring system module, pulse oximetry",
36585,"Patient monitoring system module, printing",
36757,Patient monitoring system module rack,
45552,"Patient monitoring system module, intracranial pressure",
36552,"Patient monitoring system module, carbon dioxide",
36550,"Patient monitoring system module, blood pressure, invasive",
36561,"Patient monitoring system module, cardiac output",
37323,"Patient monitoring system module, electroencephalographic",
37061,"Patient monitoring system module, multiple-gas",
12103,Impedance cardiograph,
52867,"Multiple electrolyte IVD, calibrator",
36890,Isoflurane anaesthesia vaporizer,
36980,Sevoflurane anaesthesia vaporizer,
35476,Haematological cell analyser IVD,
55864,"Non-blood cell primer/calibrator/control material IVD, reagent",
55865,"Full blood count IVD, calibrator",
55866,"Full blood count IVD, control",
61435,Intracranial/compartmental-pressure monitor calibrator/cable,
59240,Chloride (Cl-) electrode IVD,
59248,Potassium (K+) electrode IVD,
59249,Sodium (Na+) electrode IVD,
59241,Reference electrode IVD,
45554,"Patient monitoring system module, respiratory",
66245,"Dental surgical power tool motorized handpiece/set, electric",
36047,Ultrasonic dental scaling/debridement system,
45406,Dental abrasive air jet system handpiece,
16355,Endodontic apex locator,
35775,Dental/surgical polymerization lamp,
37607,"Diagnostic x-ray system generator, hand-held",
45403,Dental abrasive air jet system,
66227,"Dental surgical power tool motor, electric",
60930,"Dental delivery system instrument unit, electric",
44859,Gutta-percha injector,
47010,Dental ultrasonic surgical system,
44905,"Dental digital imaging sensor, intraoral",
46035,"Ultrasonic dental scaling/debridement system handpiece tip, endodontic",
47015,Dental ultrasonic surgical system handpiece tip,
44908,"Ultrasonic dental scaling/debridement system handpiece tip, periodontal",
44907,Ultrasonic dental scaling/debridement system handpiece,
47014,Dental ultrasonic surgical system handpiece,
45257,Dental computed radiography digital imaging scanner,
35970,Dental irrigation/aspiration syringe,
63641,Alternating-pressure bed mattress,
64779,"Face splash shield, reusable",
10960,Colposcope,
38470,Centralized patient monitor,
17895,Cardiopulmonary stress exercise trolley,
61956,Obstetrical monitoring/analysis software,
41679,"Breathing circuit condensate trap, single-use",
37258,Tocodynamometer probe,
36970,Noninvasive vascular ultrasound system probe,
60635,Electrocardiographic electrode connector,
52859,"Multiple blood gas/haemoximetry/electrolyte analyte IVD, calibrator",
54498,"Multiple blood gas analyte IVD, kit, ion-selective electrode (ISE)",
52860,"Multiple blood gas/haemoximetry/electrolyte analyte IVD, control",
41875,"Electric-motor-driven wheelchair, occupant-controlled",
60837,"Microbial medical gas filter, single-use",
46816,Heat/moisture exchanger/microbial medical gas filter,
56736,"Air-conduction hearing aid, receiver-in-the-ear",
10234,Rotating pneumatic tourniquet system,
37047,"Arm procedure positioner, reusable",
35375,Stopcock,
35871,Denture cleanser,
11170,Denture cushion,
60408,Dental caries detecting stain,
46128,Karaya denture adhesive,
46124,"Karaya/acacia denture adhesive, high sodium borate",
14034,"Continuous electronic patient thermometer, battery-powered",
34175,"Acupuncture needle, single-use",
57960,"Multiple physiological parameter spot-check system, clinical",
35372,Analgesic transcutaneous electrical nerve stimulation system,
33819,"Total human chorionic gonadotropin IVD, kit, rapid ICT, clinical",
46573,Physical therapy transcutaneous neuromuscular electrical stimulation system,
46647,"Orthopaedic fixation plate, non-bioabsorbable",
38152,Tibia intramedullary nail,
66947,Orthopaedic bone screw (non-sliding),
58959,Pin-sleeve orthopaedic bone screw,
46139,Bone nail end-cap,
55895,"Haemoglobin E (HbE) IVD , control",
63720,"Manual endodontic file/rasp, single-use",
65454,"SARS-CoV-2 antigen IVD, kit, rapid ICT, self-testing",
38161,Metallic spinal interbody fusion cage,
38777,Endodontic paper point,
31872,Natural gutta-percha,
16187,"Dental appliance fabrication material, ceramic",
44727,Dental porcelain/ceramic restoration kit,
62110,Dental prosthesis dye,
12304,Oral lavage system,
13369,"Skin treatment/dressing-supportive limb/finger bandage, single-use",
44047,"First aid kit, non-medicated, single-use",
36066,"Cardiopulmonary resuscitation mask, reusable",
17184,"Peripheral angioplasty balloon catheter, basic",
34782,Dentine bonding agent/set,
40529,"Rotary/reciprocating endodontic file/rasp, reusable",
45019,Submucosal injection needle,
38835,"Surgical instrument/endoscope cleaning utensil, single-use",
34878,"Surgical instrument/endoscope cleaning utensil, reusable",
44039,"First aid kit, medicated",
10284,"Pressure bandage, non-latex, single-use",
61223,"Pressure bandage, non-latex, reusable",
47771,"Scar-management dressing, single-use",
46807,Head-worn lamp,
32692,"Surgical binoculars, reusable",
63669,Intraoral optical scanning system,
44606,"Hand-held intraoral dental x-ray system, digital",
37704,"Anaesthesia breathing circuit, single-use",
38000,"Nylon suture, non-bioabsorbable, monofilament",
13910,Silk suture,
17471,"Polyester suture, bioabsorbable, multifilament, non-antimicrobial",
13909,"Polyolefin/fluoropolymer suture, monofilament",
13906,"Polyester suture, non-bioabsorbable, multifilament",
16584,"Polyester suture, bioabsorbable, monofilament, non-antimicrobial",
35310,Orthodontic retainer,
63550,"Rotary/reciprocating endodontic file/rasp, single-use",
46581,"Orthodontic bracket, metal",
31797,Orthodontic spring,
41397,Orthodontic archwire,
61228,External cuff/pad connection tubing,
17230,"Tourniquet cuff, reusable",
36087,"Pulse oximeter probe, reprocessed",
42327,Anaesthesia workstation common gas outlet,
63118,Multi-purpose invasive/noninvasive electrode kit,
16204,Orthodontic wire,
38711,"Flexible endoscopic biopsy forceps, single-use",
45712,"Gastrointestinal/biliary dilation balloon catheter, non-medicated",
16704,Glass ionomer dental cement,
36153,Dental etching solution,
16176,Body exhaust system,
34489,Pneumatic massager,
60924,"Hand-held ultrasound imaging system, body-surface",
38477,"Breast pump, manual",
38478,"Breast pump, electric",
58059,"Plant polysaccharide haemostatic agent, non-bioabsorbable, non-antimicrobial",
44970,"Exudate-absorbent dressing, non-gel, non-antimicrobial",
46854,"Wound-nonadherent dressing, absorbent, non-antimicrobial",
43186,"Exudate-absorbent dressing, hydrophilic-gel, non-antimicrobial",
67091,Home-use laser epilator,
58786,Dermatological diode laser system,
16156,Aneroid manual sphygmomanometer,
38832,Hand-held examination/treatment light,
11950,"Percussion hammer, manual, reusable",
34864,Adhesive bandage,
43000,"First aid kit, non-medicated, reusable",
47157,Neural-tissue balloon catheter,
62537,"Glucose monitoring system IVD, home-use",
46651,"Spinal bone screw, non-bioabsorbable",
60762,Polymeric spinal interbody fusion cage,
65115,Bone-screw internal spinal fixation system hook,
59870,"Open-surgery manual linear cutting stapler, single-use",
59873,"Open-surgery manual linear stapler, single-use",
59871,"Endoscopic manual linear cutting stapler, single-use",
62645,"Glucose analyser IVD, home-use",
53303,"Glucose IVD, kit, electrometry",
32297,"Surgical cap, single-use",
61869,"Open-surgery electrosurgical handpiece/electrode, monopolar, single-use",
56296,"Open-surgery electrosurgical handpiece/electrode, bipolar, single-use",
61874,"Open-surgery electrosurgical electrode, monopolar, single-use",
61875,"Endoscopic electrosurgical electrode, monopolar, single-use",
47848,"Open-surgery electrosurgical handpiece/electrode, bipolar, reusable",
60793,"Surgical irrigation/aspiration handpiece, single-use",
45253,Orthopaedic cement preparation/delivery kit,
47129,Balloon kyphoplasty kit,
58031,Bone access channel kit,
47021,Inflatable bone tamp,
47997,Bone grafting cannula,
60748,"Periodontal disease-associated bacteria/genetic risk factor IVD, kit, nucleic acid technique (NAT)",
60478,Bone access cannula,
61630,Haemodialysis/central venous catheterization kit,
60879,Haemodialysis catheterization kit,
32031,"Indwelling urethral catheterization kit, adult",
10729,Centrally-inserted central venous catheter,
61594,"Central venous catheterization kit, short-term",
60862,Natural conception assistance kit,
54255,"Luteinizing hormone (LH) IVD, kit, rapid ICT, clinical",
65841,"Follicle stimulating hormone (FSH) IVD, kit, rapid ICT, self-testing",
37606,"Diagnostic x-ray system generator, portable",
37643,"Portable basic diagnostic x-ray system, digital",
38128,"Vascular dilator, single-use",
17927,Intravascular extraction catheter-snare,
45419,Cardiac occluder delivery kit,
43239,Cardiac arrhythmia monitoring system,
10688,"Angiographic catheter, single-use",
47176,"Vinyl examination/treatment glove, non-powdered",
40749,"MRI system coil, radio-frequency",
45036,"Laryngeal mask airway, single-use",
35530,"Heat/moisture exchanger, single-use",
47378,"Skin-cover adhesive strip, antimicrobial",
35091,"Surgical gown, single-use",
41512,"Push-rim manual wheelchair, non-bariatric",
58301,"Synthetic polymer semi-permeable film dressing, adhesive",
12750,"Spring-loaded pneumoperitoneum needle, single-use",
65116,Bone-screw internal spinal fixation system rod,
65114,Bone-screw internal spinal fixation system connector,
43774,"Human chorionic gonadotropin alpha-subunit IVD, calibrator",
46994,"Multiple drugs of abuse IVD, kit, rapid ICT, clinical",
41209,"Air-conduction hearing aid, canal",
60272,"Hearing aid neck induction loop, wireless input",
62552,Ostomy bag protector,
64155,"Cotinine IVD, kit, rapid ICT, clinical",
30519,"Cannabinoid/cannabinoid metabolite IVD, kit, rapid ICT, clinical",
64153,"Fentanyl IVD, kit, rapid ICT, clinical",
33873,Skin-closing tension device,
44898,"Scar-management dressing, reusable",
11531,Endometrial biopsy kit,
53462,"Triglyceride IVD, reagent",
53362,"Total cholesterol lipid IVD, reagent",
56682,Ion-selective analyser IVD,
37926,Electronic pipette,
36785,General-purpose thermostat,
36465,General-purpose centrifuge IVD,
60736,Nucleic acid sample preparation instrument IVD,
56691,Erthrocyte sedimentation rate (ESR) analyser IVD,
57862,"Microplate reader IVD, automated/semi-automated",
17489,Microplate washer IVD,
38727,"General-purpose surgical scissors, reusable",
11305,"Closed-wound drain, non-bioabsorbable",
16779,"Suction/irrigation tubing, single-use",
61503,Nephrostomy catheter introduction needle,
62244,"Urodynamic manometric catheter, non-electronic",
34926,Ureteral catheter,
41893,Medical device service rail clamp,
37142,"Endoscopic-access dilator, reusable",
34923,"Suction system catheter, general-purpose",
35561,"Specimen container mailer, non-insulated",
40915,Stationary x-ray grid,
37413,Orthodontic ligature director,
60734,"Needle guide, reusable",
61502,Vascular catheter introduction needle,
47657,"Tracheostomy tube, reinforced, non-customized, single-use",
34930,Single-administration urethral drainage/irrigation catheter,
35529,Invasive blood pressure monitoring tubing set,
58704,Radial artery compression device,
35925,"Tourniquet cuff, single-use",
37329,Electric pad whole-body heating system,
35156,Percutaneous radio-frequency ablation system generator,
58836,Irreversible electroporation system,
47179,"Hevea-latex surgical glove, powdered",
47178,"Hevea-latex surgical glove, non-powdered, non-antimicrobial",
47172,"Hevea-latex examination/treatment glove, non-powdered, non-antimicrobial",
60738,"Endoscopic insufflation tubing set, single-use",
34143,"Endoscopic bite block, basic, single-use",
60760,Endoscope channel support kit,
64018,Instrument hygienic-transportation bag,
60796,General-body orifice lubricant,
61965,Medical device cleaning sponge/set,
46678,Flexible endoscopic biopsy handpiece/needle,
65702,"Endoscope transport/sterilization protective cover, single-use",
46102,"Surgical irrigation tubing set, single-use",
38825,"General-purpose endoscopic needle, single-use",
38821,"Endoscopic-access dilator, single-use",
46691,"Gastro-urological guidewire, single-use",
46822,Carbon dioxide sensor/cable,
17942,Cerebral oximeter,
45138,"Basic male condom, Hevea-latex",
62194,Electric pad localized-body heating system,
46323,Ear canal lavage system,
36560,Hand-held electric massager,
12740,"Dental syringe needle, single-use",
58497,"Blood collection set, invasive",
65416,"Basic intravenous administration set, invasive",
31817,Basic manual toothbrush,
42463,Circulating-fluid localized thermal therapy system control unit,
58288,"Dental appliance fabrication material, thermoplastic",
62538,"Glucose monitoring system IVD, point-of-care",
62646,"Glucose analyser IVD, point-of-care",
53313,"Glycated haemoglobin (HbA1c) IVD, kit, liquid chromatography",
53315,"Glycated haemoglobin (HbA1c) IVD, calibrator",
44435,"Glycated haemoglobin (HbA1c) IVD, control",
44407,High performance liquid chromatography analyser column IVD,
35968,Glycated haemoglobin (HbA1C) analyser IVD,
62206,"Glycated haemoglobin (HbA1c) monitoring system IVD, point-of-care",
63759,"Insulin-like growth factor binding protein 1 (IGFBP-1) IVD, kit, enzyme immunoassay (EIA)",
57272,"Haemoglobin detection IVD, control",
57273,"Haemoglobin detection IVD, reagent",
62221,"Uric acid monitoring system IVD, home-use",
62643,"Multiple clinical chemistry analyte monitoring system IVD, home-use",
59230,"Hypodermic needle, single-use",
10691,Vascular microcatheter,
44088,"Coronary angioplasty balloon catheter, cutting/scoring",
16668,"Carbide dental bur, reusable",
45236,Temporary dental crown/bridge resin,
47474,"Exudate-absorbent dressing, hydrophilic-gel, antimicrobial",
12873,Stationary oxygen concentrator,
62641,"Electrocardiograph, home-use",
36866,Pulse oximeter tester,
47489,"Manual-inflation electronic sphygmomanometer, portable",
48041,"Multiple physiological parameter spot-check system, home-use",
43315,Surgical hood,
47890,Disposable surgical irrigation/aspiration system,
46680,"Oesophageal endoscopic ligator, single-use",
16835,"Soft-tissue biopsy procedure kit, non-medicated",
38719,"Polypectomy endoscopic ligator, single-use",
61207,"Gastrointestinal endoscopic clip, short-term",
62042,"Nebulizing system delivery set, reusable",
13680,"Diagnostic spirometer, professional",
17827,Bronchial balloon catheter,
17453,Cardiac valvuloplasty catheter,
36612,"Image display unit, colour",
36615,"Image display unit, monochrome",
35209,Non-fixed blood collection needle,
64821,"Public face mask, single-use",
35065,Prescription spectacles,
39694,Tinted non-prescription spectacles,
37796,Foetal/maternal prenatal monitor,
43630,Polymer-metal tracheal/bronchial stent,
61751,Polymer-metal oesophageal stent,
